brillenglas	b r ɪ l ə n ɣ l ɑ s
broddelen	b r ɔ d ə l ə n
broederloos	b r u d ə r l oː s
broedermoord	b r u d ə r m oː r t
broedpaar	b r u t p aː r
broeibak	b r u i̯ b ɑ k
broeihoop	b r u i̯ ɦ oː p
brokkelen	b r ɔ k ə l ə n
brommer	b r ɔ m ə r
bromvlieg	b r ɔ m v l i x
broodhaan	b r oː t ɦ aː n
broodroof	b r oː t r oː f
broodrooster	b r oː t r oː s t ə r
broodtrommel	b r oː t r ɔ m ə l
brouillage	b r u j aː ʒ ə
brouwhuis	b r ɑ u̯ ɦ œ y̯ s
brugwachter	b r ʏ x ʋ ɑ x t ə r
bruiker	b r œ y̯ k ə r
bruiloft	b r œ y̯ l ɔ f t
bruin	b r œ y̯ n
bruinhemd	b r œ y̯ n ɦ ɛ m t
bruinogig	b r œ y̯ n oː ɣ ə x
bruinvis	b r œ y̯ n v ɪ s
brunchen	b r ʏ n ʃ ə n
brunet	b r y n ɛ t
brunette	b r y n ɛ t ə
brutaal	b r y t aː l
bruto	b r y t oː
buidelhaas	b œ y̯ d ə l ɦ aː s
buidelmol	b œ y̯ d ə l m ɔ l
buigen	b œ y̯ ɣ ə n
buikdans	b œ y̯ k d ɑ n s
buikdanseres	b œ y̯ k d ɑ n s ə r ɛ s
buikvloed	b œ y̯ k f l u t
bullebak	b ʏ l ə b ɑ k
bulleboer	b ʏ l ə b uː r
bumperkleven	b ʏ m p ə r k l eː v ə n
bumperklever	b ʏ m p ə r k l eː v ə r
bundel	b ʏ n d ə l
bundelen	b ʏ n d ə l ə n
bungelen	b ʏ ŋ ə l ə n
bureaustoel	b ʏ r oː s t u l
buren	b y r ə n
burenhulp	b yː r ə n ɦ ʏ l p
burgerbevolking	b ʏ r ɣ ə r b ə v ɔ l k ɪ ŋ
burgerschapsonderwijs	b ʏ r ɣ ə r s x ɑ p s ɔ n d ə r ʋ ɛ i̯ s
burgerzin	b ʏ r ɣ ə r z ɪ n
burgwal	b ʏ r x ʋ ɑ l
bus	b ʏ s
bussen	b ʏ s ə n
butten	b ʏ t ə n
buurmeisje	b yː r m ɛ i̯ ʃ ə
buurtkind	b yː r t k ɪ n t
buxus	b ʏ k s ʏ s
cabaleur	k aː b aː l øː r
cabriolet	k aː b r i oː l ɛ t
cacaoboter	k ɑ k ɑ u̯ b oː t ə r
cadeau	k ɑ d oː
cadeautip	k aː d oː t ɪ p
cafetaria	k aː f eː t aː r i aː
cahier	k aː j eː
calciumoxide	k ɑ l s i ʏ m ɔ k s i d ə
calvijn	k ɑ l v ɛ i̯ n
campagne	k ɑ m p ɑ n j ə
cartotheek	k ɑ r t oː t eː k
casuïstiek	k aː z y ɪ s t i k
catalonisch	k aː t aː l oː n i s
categoriseren	k ɑ t ə ɣ oː r i z eː r ə n
cel	s ɛ l
centime	s ɛ n t i m ə
certificeren	s ɛ r t i f i s eː r ə n
cervix	s ɛ r v ɪ k s
chanteren	ʃ ɑ n t eː r ə n
chaos	x aː ɔ s
chapeau	ʃ aː p oː
cheffin	ʃ ɛ f ɪ n
chemie	x eː m i
chemisch	x eː m i s
cherubijn	x eː r y b ɛ i̯ n
chicaneren	ʃ i k aː n eː r ə n
chinese	ʃ i n eː s ə
chinezen	ʃ i n eː z ə n
chloor	x l oː r
chocolademelk	ʃ oː k oː l aː d ə m ɛ l k
cholera	x oː l ə r aː
chordadier	x ɔ r d aː d iː r
christiaan	k r ɪ s t i j aː n
cijferschrift	s ɛ i̯ f ə r s x r ɪ f t
cimbaal	s ɪ m b aː l
circuitje	s ɪ r k ʋ i t j j ə
cirkelen	s ɪ r k ə l ə n
cisvrouw	s ɪ s f r ɑ u̯
citroensap	s i t r u n s ɑ p
cladistiek	k l aː d ɪ s t i k
cloaca	k l oː aː k aː
clownvis	k l ɑ u̯ n v ɪ s
club	k l ʏ p
clubhuis	k l ʏ p ɦ œ y̯ s
coach	k oː t ʃ
cocktail	k ɔ k t eː l
cocon	k oː k ɔ n
cognaat	k ɔ x n aː t
collatie	k ɔ l aː t s i
columbarium	k oː l ʏ m b aː r i ʏ m
combi	k ɔ m b i
combineren	k ɔ m b i n eː r ə n
comeback	k ɑ m b ɛ k
commentariaat	k ɔ m ɛ n t aː r i j aː t
commerçant	k ɔ m ɛ r s ɑ n t
communie	k ɔ m y n i
compileren	k ɔ m p i l eː r ə n
concentreren	k ɔ n s ɛ n t r eː r ə n
concipiëren	k ɔ n s i p i eː r ə n
condenseren	k ɔ n d ɛ n s eː r ə n
confinatie	k ɔ n f i n aː t s i
confiscatie	k ɔ n f ɪ s k aː t s i
conflagratie	k ɔ n f l aː ɣ r aː t s i
conjugeren	k ɔ n j y ɣ eː r ə n
constante	k ɔ n s t ɑ n t ə
constatering	k ɔ n s t aː t eː r ɪ ŋ
consumeren	k ɔ n s y m eː r ə n
consumptiemaatschappij	k ɔ n z ʏ m p s i m aː t s x ɑ p ɛ i̯
contact	k ɔ n t ɑ k t
contraheren	k ɔ n t r aː ɦ eː r ə n
converseren	k ɔ n v ɛ r z eː r ə n
cookie	k u k i
copula	k oː p y l aː
corpulent	k ɔ r p y l ɛ n t
corrector	k ɔ r ɛ k t ɔ r
coterie	k oː t ə r i
couperus	k u p eː r ʏ s
creatief	k r eː j aː t i f
creativiteit	k r eː j aː t i v i t ɛ i̯ t
crematorium	k r eː m aː t oː r i ʏ m
creool	k r eː oː l
crisette	k r i z ɛ t ə
cruiseboot	k r uː s b oː t
cultuurvolger	k ʏ l t yː r f ɔ l ɣ ə r
daadkrachtig	d aː t k r ɑ x t ə x
daalder	d aː l d ə r
dagactief	d ɑ x ɑ k t i f
dagboek	d ɑ ɣ b u k
dagdier	d ɑ x d iː r
dakgoot	d ɑ k x oː t
dakisolatie	d ɑ k i z oː l aː t s i
damhert	d ɑ m ɦ ɛ r t
dammen	d ɑ m ə n
damschijf	d ɑ m s x ɛ i̯ f
damspel	d ɑ m s p ɛ l
damstuk	d ɑ m s t ʏ k
dankloos	d ɑ ŋ k l oː s
danshuis	d ɑ n s ɦ œ y̯ s
dansplaat	d ɑ n s p l aː t
dapperheid	d ɑ p ə r ɦ ɛ i̯ t
darmbeen	d ɑ r m b eː n
darmsap	d ɑ r m s ɑ p
dassenhol	d ɑ s ə n ɦ ɔ l
dauwdruppel	d ɑ u̯ d r ʏ p ə l
david	d aː v ɪ t
decentraliseren	d eː s ɛ n t r aː l i z eː r ə n
decyl	d eː s i l
deed	d eː t
deelwoordelijk	d eː l ʋ oː r d ə l ə k
degenkrab	d eː ɣ ə n k r ɑ p
dekbedovertrek	d ɛ k b ɛ t oː v ə r t r ɛ k
delfstofkunde	d ɛ l f s t ɔ f k ʏ n d ə
delta	d ɛ l t aː
deltaplan	d ɛ l t aː p l ɑ n
dementeren	d eː m ɛ n t eː r ə n
democratisch	d eː m oː k r aː t i s
demonstreren	d eː m ɔ n s t r eː r ə n
denkpiste	d ɛ ŋ k p i s t ə
denkraam	d ɛ ŋ k r aː m
denneappel	d ɛ n ə ɑ p ə l
depri	d eː p r i
deren	d eː r ə n
desalniettemin	d ɛ z ɑ l n i t ə m ɪ n
deserteren	d eː z ə r t eː r ə n
desinformatie	d ɛ s ɪ n f ɔ r m aː t s i
destilleren	d ɛ s t i l eː r ə n
deugd	d øː x t
deugen	d øː ɣ ə n
deurhamer	d øː r ɦ aː m ə r
deva	d eː v aː
dextrogyr	d ɛ k s t r oː ɣ iː r
deïsmus	d eː ɪ s m ʏ s
diabetes	d i aː b eː t ə s
dichtbinden	d ɪ x t b ɪ n d ə n
dichter	d ɪ x t ə r
dictaat	d ɪ k t aː t
dienen	d i n ə n
dienstbode	d i n s t b oː d ə
dienstman	d i n s t m ɑ n
diepvries	d i p f r i s
diepvriezen	d i p f r i z ə n
dierenleed	d iː r ə n l eː t
dierenrechtenactivist	d iː r ə n r ɛ x t ə n ɑ k t i v ɪ s t
diergedicht	d iː r ɣ ə d ɪ x t
dieronterend	d iː r ɔ n t eː r ə n t
diesellocomotief	d i z ə l l oː k oː m oː t i f
differentiaalrekening	d ɪ f ə r ɛ n t ʃ aː l r eː k ə n ɪ ŋ
differentiatie	d ɪ f ə r ɛ n t ʃ aː t s i
digereren	d i ɣ ə r eː r ə n
dijkage	d ɛ i̯ k aː ʒ ə
dijker	d ɛ i̯ k ə r
dijkramp	d ɛ i̯ k r ɑ m p
dijn	d ɛ i̯ n
dikdarm	d ɪ k d ɑ r m
dikzakken	d ɪ k s ɑ k ə n
dingen	d ɪ ŋ ə n
dinsdag	d ɪ n z d ɑ x
dissel	d ɪ s ə l
distelvijg	d ɪ s t ə l v ɛ i̯ x
docu	d oː k y
documentatie	d oː k y m ɛ n t aː t s i
dodenmasker	d oː d ə n m ɑ s k ə r
dodentol	d oː d ə n t ɔ l
doelpunt	d u l p ʏ n t
doen	d u n
doenlijk	d u n l ə k
dof	d ɔ f
dokter	d ɔ k t ə r
dolleman	d ɔ l ə m ɑ n
dollemansrit	d ɔ l ə m ɑ n s r ɪ t
dolt	d ɔ l t
dom	d ɔ m
domein	d oː m ɛ i̯ n
dommekracht	d ɔ m ə k r ɑ x t
dommelen	d ɔ m ə l ə n
domper	d ɔ m p ə r
dompneus	d ɔ m p n øː s
domrechts	d ɔ m r ɛ x t s
donderdags	d ɔ n d ə r d ɑ x s
dondergod	d ɔ n d ə r ɣ ɔ t
donderroede	d ɔ n d ə r r u d ə
donderstraal	d ɔ n d ə r s t r aː l
donker	d ɔ ŋ k ə r
doodceel	d oː t s eː l
dooddoener	d oː t d u n ə r
doods	d oː t s
doodsbang	d oː t s b ɑ ŋ
doodsengel	d oː t s ɛ ŋ ə l
doof	d oː f
doop	d oː p
doopsgezinde	d oː p s x ə z ɪ n d ə
doorgeefluik	d oː r ɣ eː f l œ y̯ k
doorkijkblouse	d oː r k ɛ i̯ k b l u s
doorlatends	d oː r l aː t ə n t s
doorvochtigen	d oː r v ɔ x t ə ɣ ə n
doorzetten	d oː r z ɛ t ə n
doorzoeken	d oː r z u k ə n
dopeling	d oː p ə l ɪ ŋ
doperwt	d ɔ p ɛ r t
dopingarts	d oː p ɪ ŋ ɑ r t s
doppen	d ɔ p ə n
dormitorium	d ɔ r m ɪ t oː r i ʏ m
dorpsgenote	d ɔ r p s x ə n oː t ə
dorpshuis	d ɔ r p s ɦ œ y̯ s
doseren	d oː z eː r ə n
download	d ɑ u̯ n l oː t
draag	d r aː x
draagbaar	d r aː x b aː r
draai	d r aː i̯
draaiboek	d r aː i̯ b u k
draaideurcrimineel	d r aː i̯ d øː r k r i m i n eː l
draak	d r aː k
drankbestrijding	d r ɑ ŋ k b ə s t r ɛ i̯ d ɪ ŋ
dreigbrief	d r ɛ i̯ x b r i f
driecilinder	d r i s i l ɪ n d ə r
driehoek	d r i ɦ u k
driehonderd	d r i ɦ ɔ n d ə r t
drieëndertig	d r i ɛ n d ɛ r t ə x
drijfjacht	d r ɛ i̯ f j ɑ x t
dril	d r ɪ l
drillen	d r ɪ l ə n
drinkwater	d r i ŋ k ʋ aː t ə r
droeg	d r u x
droesem	d r u s ə m
drogen	d r oː ɣ ə n
dronk	d r ɔ ŋ k
dronkaard	d r ɔ ŋ k aː r d
droogmakerij	d r oː x m aː k ə r ɛ i̯
drop	d r ɔ p
drugsmisbruik	d r ʏ ɡ s m ɪ s b r œ y̯ k
drukpers	d r ʏ k p ɛ r s
druktoets	d r ʏ k t u t s
dualiteit	d y aː l i t ɛ i̯ t
dubbelklikken	d ʏ b ə l k l ɪ k ə n
dubben	d ʏ b ə n
duet	d y ɛ t
duffel	d ʏ f ə l
duikbril	d œ y̯ k b r ɪ l
duiken	d œ y̯ k ə n
duikschool	d œ y̯ k s x oː l
duitser	d œ y̯ t s ə r
duivel	d œ y̯ v ə l
duizendpoot	d œ y̯ z ə n t p oː t
dun	d ʏ n
dunk	d ʏ ŋ k
duppie	d ʏ p i
durven	d ʏ r v ə n
dwangbuis	d ʋ ɑ ŋ b œ y̯ s
dwarszitten	d ʋ ɑ r s ɪ t ə n
dweilorkest	d ʋ ɛ i̯ l ɔ r k ɛ s t
dwerg	d ʋ ɛ r x
dwergchimpansee	d ʋ ɛ r x ʃ ɪ m p ɑ n s eː
dwingeland	d ʋ ɪ ŋ ə l ɑ n t
dysfemisme	d ɪ s f eː m ɪ s m ə
echapperen	eː ʃ ɑ p eː r ə n
echt	ɛ x t
echtscheiding	ɛ x t s x ɛ i̯ d ɪ ŋ
eczeem	ɛ k s eː m
edik	eː d ɪ k
eendenmol	eː n d ə n m ɔ l
eendvliegtuig	eː n t f l i x t œ y̯ x
eenenzestig	eː n ə n s ɛ s t ə x
eenheidsuitgang	eː n ɦ ɛ i̯ t s œ y̯ t x ɑ ŋ
eerst	eː r s t
eest	eː s t
eeuwig	eː u̯ ə x
eeuwjaar	eː u̯ j aː r
egalitarisme	eː ɣ aː l i t aː r ɪ s m ə
egyptenaar	eː ɣ ɪ p t ə n aː r
eieren	ɛ i̯ j ə r ə n
eigen	ɛ i̯ ɣ ə n
eigenen	ɛ i̯ ɣ ə n ə n
eikvaren	ɛ i̯ k v aː r ə n
eilandstaat	ɛ i̯ l ɑ n t s t aː t
eindbestemming	ɛ i̯ n t b ə s t ɛ m ɪ ŋ
eisprong	ɛ i̯ s p r ɔ ŋ
el	ɛ l
elfen	ɛ l v ə n
elfstedentocht	ɛ l f s t eː d ə n t ɔ x t
eline	eː l i n ə
elitair	eː l i t ɛː r
ellerling	ɛ l ə r l ɪ ŋ
elpenbeen	ɛ l p ə n b eː n
elvin	ɛ l v ɪ n
emigreren	eː m i ɣ r eː r ə n
enkel	ɛ ŋ k ə l
enthousiasme	ɑ n t u ʒ ɑ s m ə
epiduraal	eː p i d y r aː l
epifauna	eː p i f ɑ u̯ n aː
eponiem	eː p oː n i m
erectie	eː r ɛ k s i
erelid	eː r ə l ɪ t
ereteken	eː r ə t eː k ə n
ergeren	ɛ r ɣ ə r ə n
ertoe	ɛ r t u
eschatologie	ɛ s x aː t oː l oː ɡ i
eskimo	ɛ s k i m oː
esthetisch	ɛ s t eː t i s
etaleren	eː t aː l eː r ə n
ethanol	eː t aː n ɔ l
etheen	eː t eː n
ethiek	eː t i k
etnologie	ɛ t n oː l oː ɣ i
evenaar	eː v ə n aː r
exerceren	ɛ k s ə r s eː r ə n
expanderen	ɛ k s p ɑ n d eː r ə n
exposeren	ɛ k s p oː z eː r ə n
extremofiel	ɛ k s t r eː m oː f i l
fabelleer	f aː b ə l l eː r
fabelwezen	f aː b ə l ʋ eː z ə n
fabrieksrijder	f aː b r i k s r ɛ i̯ d ə r
facetoog	f aː s ɛ t oː x
factotums	f ɑ k t o t ʏ m s
familie	f ɑ m i l i
familienaam	f aː m i l i n aː m
fanaal	f aː n aː l
fantasie	f ɑ n t aː z i
fasciatie	f ɑ s i aː t s i
fax	f ɑ k s
faxen	f ɑ k s ə n
femelaar	f eː m ə l aː r
ferrometaal	f ɛ r oː m eː t aː l
festival	f ɛ s t i v ɑ l
fierljeppen	f iː r ə l j ɛ p ə n
fietsendrager	f i t s ə n d r aː ɣ ə r
fietsenstalling	f i t s ə n s t ɑ l ɪ ŋ
fietsinfrastructuur	f i t s ɪ n f r aː s t r ʏ k t yː r
fietsstrook	f i t s t r oː k
fietst	f i t s t
figureren	f i ɣ y r eː r ə n
fikken	f ɪ k ə n
fiksen	f ɪ k s ə n
filharmonisch	f i l ɦ ɑ r m oː n i s
filmhuis	f ɪ l m ɦ œ y̯ s
filoloog	f i l oː l oː ɣ
fissa	f ɪ s aː
fjord	f j ɔ r t
flansen	f l ɑ n s ə n
flauwte	f l ɑ u̯ t ə
flexie	f l ɛ k s i
flikflooien	f l ɪ k f l oː i̯ ə n
flikkers	f l ɪ k ə r s
flinterdun	f l ɪ n t ə r d ʏ n
flippen	f l ɪ p ə n
floppen	f l ɔ p ə n
fluitschip	f l œ y̯ t s x ɪ p
fok	f ɔ k
fokken	f ɔ k ə n
fokschaap	f ɔ k s x aː p
formatteren	f ɔ r m ɑ t eː r ə n
fossielenbestand	f ɔ s i l ə n b ə s t ɑ n t
fotocamera	f oː t oː k aː m ə r aː
fragiliteit	f r aː ɣ i l i t ɛ i̯ t
fragmentenhypothese	f r ɑ x m ɛ n t ə n ɦ i p oː t eː z ə
frank	f r ɑ ŋ k
fraseur	f r aː z øː r
frederik	f r eː d ə r ɪ k
freon	f r eː ɔ n
frikandel	f r i k ɑ n d ɛ l
frituren	f r i t y r ə n
fêteren	f ɛ t eː r ə n
gaasvlieg	ɣ aː s f l i x
gade	ɣ aː d ə
gaden	ɣ aː d ə n
gaffel	ɣ ɑ f ə l
galaat	ɣ aː l aː t
galgenaas	ɣ ɑ l ɣ ə n aː s
galm	ɣ ɑ l m
garantie	ɣ a r ɑ n t s i
gasbeving	ɣ ɑ s b eː v ɪ ŋ
gassen	ɣ ɑ s ə n
gasthuis	ɣ ɑ s t ɦ œ y̯ s
gastvrouw	ɣ ɑ s t f r ɑ u̯
gauwdief	ɣ ɑ u̯ d i f
gaza	ɣ aː z aː
gazastrook	ɣ aː z aː s t r oː k
ge	ɣ ə
gebaard	ɣ ə b aː r t
gebed	ɣ ə b ɛ t
gebruikelijk	ɣ ə b r œ y̯ k ə l ə k
gebruiken	ɣ ə b r œ y̯ k ə n
gebruiksonvriendelijk	ɣ ə b r œ y̯ k s ɔ n v r i n d ə l ə k
gebruikt	ɣ ə b r œ y̯ k t
gedacht	ɣ ə d ɑ x t
gedachtenis	ɣ ə d ɑ x t ə n ɪ s
gedachtetrant	ɣ ə d ɑ x t ə t r ɑ n t
gedankt	ɣ ə d ɑ ŋ k t
gedenken	ɣ ə d ɛ ŋ k ə n
gedwee	ɣ ə d ʋ eː
geelzucht	ɣ eː l z ʏ x t
geesteskrank	ɣ eː s t ə s k r ɑ ŋ k
geestesziekte	ɣ eː s t ə s i k t ə
geeuwen	ɣ eː u̯ ə n
gegevensdrager	ɣ ə ɣ eː v ə n s d r aː ɣ ə r
geheelal	ɣ ə ɦ eː l ɑ l
geheimschrift	ɣ ə ɦ ɛ i̯ m s x r ɪ f t
geheimtaal	ɣ ə ɦ ɛ i̯ m t aː l
geheten	ɣ ə ɦ eː t ə n
geheugenstick	ɣ ə ɦ øː ɣ ə n s t ɪ k
gehoopt	ɣ ə ɦ oː p t
gehoorzaal	ɣ ə ɦ oː r z aː l
geilbek	ɣ ɛ i̯ l b ɛ k
gein	ɣ ɛ i̯ n
geitenherder	ɣ ɛ i̯ t ə n ɦ ɛ r d ə r
geitenmelker	ɣ ɛ i̯ t ə n m ɛ l k ə r
geldezel	ɣ ɛ l t eː z ə l
geldhandel	ɣ ɛ l t ɦ ɑ n d ə l
geldkraan	ɣ ɛ l t k r aː n
geldzorg	ɣ ɛ l t s ɔ r x
geleedpotige	ɣ ə l eː t p oː t ə ɣ ə
gelijk	ɣ ə l ɛ i k
gelijkstaat	ɣ ə l ɛ i̯ k s t aː t
geluidsoverlast	ɣ ə l œ y̯ t s oː v ə r l ɑ s t
geluksvogel	ɣ ə l ʏ k s f oː ɣ ə l
gelul	ɣ ə l ʏ l
gemaal	ɣ ə m aː l
gemakshalve	ɣ ə m ɑ k s ɦ ɑ l v ə
gematigdst	ɣ ə m a t ə x t s t
gemeenslachtig	ɣ ə m eː n s l ɑ x t ə x
genitivisch	ɡ eː n i t iː v i s
genoten	ɣ ə n oː t ə n
geograaf	ɣ eː oː ɣ r aː f
geografisch	ɣ eː oː ɣ r aː f i s
geschiedboek	ɣ ə s x i t b u k
geschut	ɣ ə s x ʏ t
geslachtsklier	ɣ ə s l ɑ x t s k l iː r
gespan	ɣ ə s p ɑ n
gespen	ɣ ɛ s p ə n
gesteun	ɣ ə s t øː n
gesticuleren	ɣ ɛ s t i k y l eː r ə n
geul	ɣ øː l
geur	ɣ øː r
geuren	ɣ øː r ə n
gevader	ɣ ə v aː d ə r
gevangenis	ɣ ə v ɑ ŋ ə n ɪ s
gevangenzetten	ɣ ə v ɑ ŋ ə n z ɛ t ə n
gevel	ɣ eː v ə l
gewaarworden	ɣ ə ʋ aː r ʋ ɔ r d ə n
gewas	ɣ ə ʋ ɑ s
gewei	ɣ ə ʋ ɛ i̯
gezegde	ɣ ə z ɛ x d ə
gezegende	ɣ ə z eː ɣ ə n d ə
gezin	ɣ ə z ɪ n
gibbon	ɣ ɪ b ɔ n
gids	ɣ ɪ t s
gierst	x iː r s t
gifslang	ɣ ɪ f s l ɑ ŋ
gifstof	ɣ ɪ f s t ɔ f
giftslang	ɣ ɪ f t s l ɑ ŋ
gij	ɣ ɛ i̯
gips	ɣ ɪ p s
giraf	ʒ i r ɑ f
gist	ɣ ɪ s t
gladneus	ɣ l ɑ t n øː s
glamping	ɡ l ɛ m p ɪ ŋ
glasmie	ɣ l ɑ s m i
gletser	ɣ l ɛ t s ə r
glijbaan	ɣ l ɛ i b aː n
glijboot	ɣ l ɛ i̯ b oː t
glimlach	ɣ l ɪ m l ɑ x
glimmen	ɣ l ɪ m ə n
glop	ɣ l ɔ p
godenzoon	ɣ oː d ə n z oː n
godsbewijs	ɣ ɔ t s b ə ʋ ɛ i̯ s
godsdienstoorlog	ɣ ɔ t s d i n s t oː r l ɔ x
godshuis	ɣ ɔ t s ɦ œ y̯ s
godslastering	ɣ ɔ t s l ɑ s t ə r ɪ ŋ
godzaligheid	ɣ ɔ t s aː l ə x ɦ ɛ i̯ t
goeddeels	ɣ u t d eː l s
goede	ɣ u d ə
goedkoop	ɣ u t k oː p
gom	ɣ ɔ m
googel	ɡ u ɡ ə l
googelden	ɡ u ɡ ə l d ə n
gooien	ɣ oː i̯ ə n
gootsteen	ɣ oː t s t eː n
gorgoon	ɣ ɔ r ɣ oː n
gorinchem	ɣ ɔ r k ə m
gothic	ɡ ɔ t ɪ k
gouda	ɣ ɑ u̯ d aː
goudsbloem	ɣ ɑ u̯ t s b l u m
goudvis	ɣ ɑ u̯ t f ɪ s
gouvernement	ɣ u v ɛ r n ə m ɛ n t
grachtenhuis	ɣ r ɑ x t ə n ɦ œ y̯ s
grafieten	ɣ r aː f i t ə n
gram	ɣ r ɑ m
gramschap	ɣ r ɑ m s x ɑ p
grasduin	ɣ r ɑ s d œ y̯ n ə n
grasland	ɣ r ɑ s l ɑ n t
gratie	ɣ r aː t s i
grauwblauw	ɣ r ɑ u̯ b l ɑ u̯
gravin	ɣ r aː v ɪ n
grensoorlog	ɣ r ɛ n s oː r l ɔ x
griek	ɣ r i k
griezel	ɣ r i z ə l
grijzig	ɣ r ɛ i̯ z ə x
gristen	ɣ r ɪ s t ə n
groenachtig	x r u nː ɑ xː t ə x
grondbloem	ɣ r ɔ n t b l u m
grondsap	ɣ r ɔ n t s ɑ p
grondvest	ɣ r ɔ n t f ɛ s t
grootgrondbezitter	ɣ r oː t x r ɔ n t b ə z ɪ t ə r
grootmoeder	ɣ r oː t m u d ə r
grootoosten	ɣ r oː t oː s t ə n
grootouder	ɣ r oː t ɑ u̯ d ə r
grootste	ɣ r oː t s t ə
gruis	ɣ r œ y̯ s
gruit	ɣ r œ y̯ t
guppie	ɣ ʏ p i
gutsje	ɣ ʏ t s j ə
gymp	ɣ ɪ m p
gênant	ʒ ə n ɑ n t
haak	ɦ aː k
haar	ɦ aː r
haarborstel	ɦ aː r b ɔ r s t ə l
haarlems	ɦ aː r l ɛ m s
haasachtige	ɦ aː s ɑ x t ə ɣ ə
habbekrats	ɦ ɑ b ə k r ɑ t s
hadden	ɦ ɑ d ə n
hagedis	ɦ aː ɣ ə d ɪ s
hagelstorm	ɦ aː ɣ ə l s t ɔ r m
haggada	ɦ ɑ ɡ aː d aː
hak	ɦ ɑ k
halachisch	ɦ aː l ɑ x i s
halal	ɦ aː l ɑ l
halfschaduw	ɦ ɑ l f s x aː d y u̯
hallo	ɦ ɑ l oː
halswender	ɦ ɑ l s ʋ ɛ n d ə r
halveren	ɦ ɑ l v eː r ə n
hamam	ɦ aː m ɑ m
hamel	ɦ aː m ə l
hamsteren	ɦ ɑ m s t ə r ə n
hamsterhaas	ɦ ɑ m s t ə r ɦ aː s
hamvraag	ɦ ɑ m v r aː x
handdoek	ɦ ɑ n d u k
handig	ɦ ɑ n d ɪ x
handschrift	ɦ ɑ n t s x r ɪ f t
handvuurwapen	ɦ ɑ n t f yː r ʋ aː p ə n
hangbrug	ɦ ɑ ŋ b r ʏ x
hans	ɦ ɑ n s
hansworst	ɦ ɑ n s ʋ ɔ r s t
hanzestad	ɦ ɑ n z ə s t ɑ t
haram	ɦ aː r aː m
hard	ɦ ɑ r t
hardnekkig	ɦ ɑ r t n ɛ k ə x
hardtin	ɦ ɑ r t ɪ n
harig	ɦ aː r ə x
harmonische	ɦ ɑ r m oː n i s ə
harmonischere	ɦ ɑ r m oː n i s ə r ə
harp	ɦ ɑ r p
hartritme	ɦ ɑ r t r ɪ t m ə
hartritmestoornis	ɦ ɑ r t r ɪ t m ə s t oː r n ɪ s
hartsvriendin	ɦ ɑ r t s f r i n d ɪ n
hasjiesj	ɦ ɑ ʃ i ʃ
hatsjie	ɦ ɑ t ʃ i
havenplaats	ɦ aː v ə n p l aː t s
heb	ɦ ɛ p
hebbend	ɦ ɛ b ə n t
hector	ɦ ɛ k t ɔ r
heelmeester	ɦ eː l m eː s t ə r
heem	ɦ eː m
heeroom	ɦ eː r oː m
heersen	ɦ eː r s ə n
heideblauwtje	ɦ ɛ i̯ d ə b l ɑ u̯ t j ə
heiden	ɦ ɛ i̯ d ə n
heinen	ɦ ɛ i̯ n ə n
heipaal	ɦ ɛ i̯ p aː l
hek	ɦ ɛ k
hekkensluiter	ɦ ɛ k ə n s l œ y̯ t ə r
helaba	ɦ e l ɑ b ɑ
heleboel	ɦ eː l ə b u l
heli	ɦ eː l i
helikopter	ɦ eː l i k ɔ p t ə r
helix	ɦ eː l ɪ k s
hellegebroed	ɦ ɛ l ə ɣ ə b r u t
helling	ɦ ɛ l ɪ ŋ
helrivier	ɦ ɛ l r i v iː r
helzen	ɦ ɛ l z ə n
hemelbestormer	ɦ eː m ə l b ə s t ɔ r m ə r
hemelen	ɦ eː m ə l ə n
hemeling	ɦ eː m ə l ɪ ŋ
hemisfeer	ɦ eː m i s f eː r
heng	ɦ ɛ ŋ
hengst	ɦ ɛ ŋ s t
herdenkingsmunt	ɦ ɛ r d ɛ ŋ k ɪ ŋ s m ʏ n t
herdruk	ɦ ɛ r d r ʏ k
hermafrodisme	ɦ ɛ r m aː f r oː d ɪ s m ə
hermelijn	ɦ ɛ r m ə l ɛ i̯ n
hermelijnkoorts	ɦ ɛ r m ə l ɛ i̯ n k oː r t s
hernhutter	ɦ ɛ r n ɦ ʏ t ə r
hersenpan	ɦ ɛ r s ə n p ɑ n
hersenschim	ɦ ɛ r s ə n s x ɪ m
hersenspinsel	ɦ ɛ r s ə n s p ɪ n s ə l
hersenvlies	ɦ ɛ r s ə n v l i s
herstel	ɦ ɛ r s t ɛ l
herstelbetaling	ɦ ɛ r s t ɛ l b ə t aː l ɪ ŋ
herstellingsoord	ɦ ɛ r s t ɛ l i ŋ s oː r t
heteluchtbad	ɦ eː t ə l ʏ x t b ɑ t
heten	ɦ eː t ə n
heulen	ɦ øː l ə n
heup	ɦ øː p
heuvel	ɦ øː v ə l
hexaan	ɦ ɛ k s aː n
hexeen	ɦ ɛ k s eː n
hiel	ɦ i l
hielenlikker	ɦ iː l ə n l ɪ k ə r
hiernumaals	ɦ iː r n y m aː l s
hindi	ɦ ɪ n d i
hindoestaan	ɦ ɪ n d u s t aː n
histologie	ɦ ɪ s t oː l oː ɣ i
historisch	ɦ ɪ s t oː r i s
hit	ɦ ɪ t
hitparade	ɦ ɪ t p aː r aː d ə
hockeyen	ɦ ɔ k i ə n
hoe	ɦ u
hoedanigheidswoord	ɦ u d aː n ə x ɦ ɛ i̯ t s ʋ oː r t
hoefijzermagneet	ɦ u f ɛ i̯ z ə r m ɑ x n eː t
hoefijzermeer	ɦ u f ɛ i̯ z ə r m eː r
hoenders	ɦ u n d ə r s
hoerendop	ɦ uː r ə n d ɔ p
hoest	ɦ u s t
hoeveel	ɦ u v eː l
hoeveelheid	ɦ u v eː l ɦ ɛ i̯ t
holbewoner	ɦ ɔ l b ə ʋ oː n ə r
hollands	ɦ ɔ l ɑ n t s
holrond	ɦ ɔ l r ɔ n t
holtetje	ɦ ɔ l t ə t j ə
hongarije	ɦ ɔ ŋ ɣ aː r ɛ i̯ j ə
hoofd	ɦ oː f t
hoofdgerecht	ɦ oː f t x ə r ɛ x t
hoofdpijndossier	ɦ oː f t p ɛ i̯ n d ɔ ʃ eː
hoofdreeks	ɦ oː f t r eː k s
hoofdrol	ɦ oː f t r ɔ l
hoofdstedelijk	ɦ oː f t s t eː d ə l ə k
hoofdtelwoord	ɦ oː f t ɛ l ʋ oː r t
hoofdvak	ɦ oː f t f ɑ k
hoogbejaarde	ɦ oː x b ə j aː r d ə
hoogtezon	ɦ oː x t ə z ɔ n
hoogzwanger	ɦ oː x z ʋ ɑ ŋ ə r
hooi	ɦ oː i̯
hooiberg	ɦ oː i̯ b ɛ r x
hooiwagenkrab	ɦ oː i̯ ʋ aː ɣ ə n k r ɑ p
hopliet	ɦ ɔ p l i t
horen	ɦ oː r ə n
horloge	ɦ ɔ r l oː ʒ ə
horlogemaker	ɦ ɔ r l oː ʒ ə m aː k ə r
hosselen	ɦ ɔ s ə l ə n
hot	ɦ ɔ t
hou	ɦ ɑ u̯
houdbaarheid	ɦ ɑ u̯ t b aː r ɦ ɛ i̯ t
houdt	ɦ ɑ u̯ t
houtsnijwerk	ɦ ɑ u̯ t s n ɛ i̯ ʋ ɛ r k
houwitser	ɦ ɑ u̯ ʋ i t s ə r
hoveling	ɦ oː v ə l ɪ ŋ
huilerig	ɦ œ y̯ l ə r ə x
huin	ɦ œ y̯ n
huisbrandolie	ɦ œ y̯ s b r ɑ n t oː l i
huishoudfolie	ɦ œ y̯ s ɦ ɑ u̯ t f oː l i
huiskamer	ɦ œ y̯ s k aː m ə r
huiskerk	ɦ œ y̯ s k ɛ r k
huisraad	ɦ œ y̯ s r aː t
huisvlijt	ɦ œ y̯ s f l ɛ i̯ t
huizenbezitter	ɦ œ y̯ z ə n b ə z ɪ t ə r
huizinga	ɦ œ y̯ z ɪ ŋ ɣ aː
hulpmiddel	ɦ ʏ l p m ɪ d ə l
hulpvaardigheid	ɦ ʏ l p f aː r d ə x ɦ ɛ i̯ t
humoraal	ɦ y m oː r aː l
humus	ɦ y m ʏ s
humusrijk	ɦ y m ʏ s r ɛ i̯ k
huns	ɦ ʏ n s
huwelijksdag	ɦ y ʋ ə l ə k s d ɑ x
hyena	ɦ i j eː n aː
hyperaldosteronisme	ɦ i p ə r ɑ l d ɔ s t ə r oː n ɪ s m ə
hypergamie	ɦ i p ə r ɣ aː m i
iberen	i b eː r ə n
icarus	i k aː r ʏ s
idee	i d eː
idioot	i d i j oː t
iel	i l
ieme	i m ə
ijsbergsla	ɛ i̯ s b ɛ r x s l aː
ijscokar	ɛ i̯ s k oː k ɑ r
ijsje	ɛ i̯ s j ə
ijssel	ɛ i̯ s ə l
ijzer	ɛ i̯ z ə r
ijzervreter	ɛ i̯ z ə r v r eː t ə r
imme	ɪ m ə
improvisatie	ɪ m p r oː v i z aː t s i
inbreken	ɪ n b r eː k ə n
inbreker	ɪ n b r eː k ə r
incalculeren	ɪ n k ɑ l k y l eː r ə n
incantatie	ɪ ŋ k ɑ n t aː t s i
inchecken	ɪ n t ʃ ɛ k ə n
inclusie	ɪ n k l y z i
indianenverhaal	ɪ n d i aː n ə n v ɛ r ɦ aː l
indommelen	ɪ n d ɔ m ə l ə n
indonesië	ɪ n d oː n eː z i j ə
inergatief	ɪ n ɛ r ɣ aː t i f
infaam	ɪ n f aː m
informatiebron	ɪ n f ɔ r m aː t s i b r ɔ n
ingeval	ɪ ŋ ɣ ə v ɑ l
inhoudsmaat	ɪ n ɦ ɑ u̯ t s m aː t
injectiespuit	ɪ n j ɛ k s i s p œ y̯ t
inleven	ɪ n l eː v ə n
inoculatie	ɪ n oː k y l aː t s i
insnijden	ɪ n s n ɛ i̯ d ə n
internetcafé	ɪ n t ə r n ɛ t k aː f eː
interval	ɪ n t ə r v ɑ l
interviewster	ɪ n t ə r v j u s t ə r
intimideren	ɪ n t i m i d eː r ə n
intonatie	ɪ n t oː n aː t s i
intraveneus	ɪ n t r aː v eː n øː s
intrusief	ɪ n t r y z i f
is	ɪ s
isolatie	i z oː l aː t s i
israëli	ɪ s r aː eː l i
iteratie	i t ə r aː t s i
itter	ɪ t ə r
ivoorsnavelspecht	i v oː r s n aː v ə l s p ɛ x t
jaar	j aː r
jaarboek	j aː r b u k
jaarmarkt	j aː r m ɑ r k t
jachthoorn	j ɑ x t ɦ oː r n
jachtklok	j ɑ x t k l ɔ k
jagen	j aː ɣ ə n
jaknikker	j aː k n ɪ k ə r
jaknikkers	j aː k n ɪ k ə r s
jammervol	j ɑ m ə r v ɔ l
japanner	j ɑ p ɑ n ə r
jappenkamp	j ɑ p ə n k ɑ m p
jargon	j ɑ r ɣ ɔ n
javaans	j aː v aː n s
jeker	j eː k ə r
jenever	j ə n eː v ə r
jeneverfles	j ə n eː v ə r f l ɛ s
jeremiëren	j eː r ə m i eː r ə n
jeugdpuist	j øː x t p œ y̯ s t
jezus	j eː z ʏ s
joet	j u t
jofel	j oː f ə l
jok	j ɔ k
joker	j oː k ə r
jokkebrok	j ɔ k ə b r ɔ k
jonas	j oː n ɑ s
jonassen	j oː n ɑ s ə n
jong	j ɔ ŋ
jonge	j ɔ ŋ ə
jonker	j ɔ ŋ k ə r
joop	j oː p
jota	j oː t aː
journalisme	ʒ uː r n aː l ɪ s m ə
jouwe	j ɑ u̯ ə
jouws	j ɑ u̯ s
jubelen	j y b ə l ə n
juichen	j œ y̯ x ə n
julienne	ʒ y l i ɛ n ə
kaag	k aː x
kaal	k aː l
kaaspiet	k aː s p i t
kadaster	k aː d ɑ s t ə r
kadaver	k aː d aː v ə r
kade	k aː d ə
kakkineus	k ɑ k i n øː s
kamer	k aː m ə r
kampeer	k ɑ m p eː r
kampen	k ɑ m p ə n
kampioen	k ɑ m p i j u n
kampong	k ɑ m p ɔ ŋ
kanarievogel	k aː n aː r i v oː ɣ ə l
kanaän	k aː n aː ɑ n
kandidaat	k ɑ n d i d aː t
kandidate	k ɑ n d i d aː t ə
kaneelsuiker	k aː n eː l s œ y̯ k ə r
kangoeroe	k ɑ ŋ ɣ u r u
kanjer	k ɑ n j ə r
kanker	k ɑ ŋ k ə r
kanonneren	k aː n ɔ n eː r ə n
kansloos	k ɑ n s l oː s
kant	k ɑ n t
kanten	k ɑ n t ə n
kantoorbediende	k ɑ n t oː r b ə d i n d ə
kantoortuin	k ɑ n t oː r t œ y̯ n
kaperbrief	k aː p ə r b r i f
kaping	k aː p ɪ ŋ
kapper	k ɑ p ə r
kapster	k ɑ p s t ə r
kapstok	k ɑ p s t ɔ k
karabach	k aː r aː b ɑ x
karabijn	k aː r aː b ɛ i̯ n
karakter	k aː r ɑ k t ə r
karavaan	k aː r aː v aː n
karel	k aː r ə l
karmisch	k ɑ r m i s
kartets	k ɑ r t ɛ t s
kasjroet	k ɑ ʃ r u t
kassen	k ɑ s ə n
katana	k aː t aː n aː
kathaai	k ɑ t ɦ aː i̯
kech	k ɛ x
keelzang	k eː l z ɑ ŋ
kehilla	k ə ɦ ɪ l aː
kehille	k ə ɦ ɪ l ə
kelt	k ɛ l t
kennel	k ɛ n ə l
kentaur	k ɛ n t ɑ u̯ ə r
kerkburcht	k ɛ r k b ʏ r x t
kerkdeur	k ɛ r k d øː r
kerkdienst	k ɛ r k d i n s t
kerkgenootschap	k ɛ r k x ə n oː t s x ɑ p
kerkorgel	k ɛ r k ɔ r ɣ ə l
kermen	k ɛ r m ə n
kermisklant	k ɛ r m ɪ s k l ɑ n t
kern	k ɛ r n
kerncentrale	k ɛ r n s ɛ n t r aː l ə
kerngezin	k ɛ r n ɣ ə z ɪ n
kernonderzeeboot	k ɛ r n ɔ n d ə r z eː b oː t
kerstmarkt	k ɛ r s t m ɑ r k t
kerstmuziek	k ɛ r s t m y z i k
kerststal	k ɛ r s t ɑ l
kerststol	k ɛ r s t ɔ l
ketel	k eː t ə l
ketting	k ɛ t ɪ ŋ
kettingkogel	k ɛ t ɪ ŋ k oː ɣ ə l
kettingroker	k ɛ t ɪ ŋ r oː k ə r
keur	k øː r
keurleger	k øː r l eː ɣ ə r
keus	k øː s
kever	k eː v ə r
kickbokser	k ɪ k b ɔ k s ə r
kielzog	k i l z ɔ x
kiev	k i j ɛ f
kim	k ɪ m
kinderkopje	k ɪ n d ə r k ɔ p j ə
kinderstoel	k ɪ n d ə r s t u l
kinderwagen	k ɪ n d ə r ʋ aː ɣ ə n
kindsoldaat	k ɪ n t s ɔ l d aː t
kinine	k i n i n ə
kinshasa	k ɪ n ʃ aː s aː
kippenborst	k ɪ p ə n b ɔ r s t
kippenbout	k ɪ p ə n b ɑ u̯ t
